[
  {
    "sport": "NFL",
    "category": "History",
    "text": "Which team won Super Bowl I?",
    "options": [
      "Dallas Cowboys",
      "Kansas City Chiefs",
      "New York Jets",
      "Green Bay Packers"
    ],
    "correctIndex": 3,
    "difficulty": 1
  },
  {
    "sport": "NFL",
    "category": "History",
    "text": "Which team lost to Green Bay in Super Bowl I?",
    "options": [
      "Dallas Cowboys",
      "Baltimore Colts",
      "Kansas City Chiefs",
      "Oakland Raiders"
    ],
    "correctIndex": 2,
    "difficulty": 2
  },
  {
    "sport": "NFL",
    "category": "History",
    "text": "In which year was Super Bowl I played?",
    "options": [
      "1969",
      "1967",
      "1970",
      "1966"
    ],
    "correctIndex": 1,
    "difficulty": 1
  },
  {
    "sport": "NFL",
    "category": "History",
    "text": "Joe Namath famously guaranteed a Super Bowl III victory for which team?",
    "options": [
      "Miami Dolphins",
      "Oakland Raiders",
      "New York Jets",
      "Baltimore Colts"
    ],
    "correctIndex": 2,
    "difficulty": 1
  },
  {
    "sport": "NFL",
    "category": "History",
    "text": "Which team completed the NFL's only perfect season, in 1972?",
    "options": [
      "Pittsburgh Steelers",
      "Dallas Cowboys",
      "Miami Dolphins",
      "Green Bay Packers"
    ],
    "correctIndex": 2,
    "difficulty": 1
  },
  {
    "sport": "NFL",
    "category": "History",
    "text": "Who coached the 1972 Miami Dolphins' perfect season?",
    "options": [
      "Don Shula",
      "Chuck Noll",
      "Tom Landry",
      "Vince Lombardi"
    ],
    "correctIndex": 0,
    "difficulty": 2
  },
  {
    "sport": "NFL",
    "category": "History",
    "text": "Which team went 16-0 in the 2007 regular season but lost the Super Bowl?",
    "options": [
      "Indianapolis Colts",
      "Dallas Cowboys",
      "Green Bay Packers",
      "New England Patriots"
    ],
    "correctIndex": 3,
    "difficulty": 1
  },
  {
    "sport": "NFL",
    "category": "History",
    "text": "Which team ended the Patriots' perfect-season bid in Super Bowl XLII?",
    "options": [
      "New York Giants",
      "Philadelphia Eagles",
      "Seattle Seahawks",
      "Pittsburgh Steelers"
    ],
    "correctIndex": 0,
    "difficulty": 1
  },
  {
    "sport": "NFL",
    "category": "History",
    "text": "Who made the famous \"Helmet Catch\" in Super Bowl XLII?",
    "options": [
      "Steve Smith",
      "Plaxico Burress",
      "Amani Toomer",
      "David Tyree"
    ],
    "correctIndex": 3,
    "difficulty": 2
  },
  {
    "sport": "NFL",
    "category": "History",
    "text": "Which team's 1970s defense was known as the \"Steel Curtain\"?",
    "options": [
      "Dallas Cowboys",
      "Minnesota Vikings",
      "Chicago Bears",
      "Pittsburgh Steelers"
    ],
    "correctIndex": 3,
    "difficulty": 1
  },
  {
    "sport": "NFL",
    "category": "History",
    "text": "Who caught the \"Immaculate Reception\"?",
    "options": [
      "Franco Harris",
      "Rocky Bleier",
      "Lynn Swann",
      "John Stallworth"
    ],
    "correctIndex": 0,
    "difficulty": 1
  },
  {
    "sport": "NFL",
    "category": "History",
    "text": "In which year did the \"Immaculate Reception\" happen?",
    "options": [
      "1972",
      "1976",
      "1970",
      "1974"
    ],
    "correctIndex": 0,
    "difficulty": 3
  },
  {
    "sport": "NFL",
    "category": "History",
    "text": "Who caught Joe Montana's pass in \"The Catch\" in January 1982?",
    "options": [
      "Freddie Solomon",
      "Roger Craig",
      "Dwight Clark",
      "Jerry Rice"
    ],
    "correctIndex": 2,
    "difficulty": 1
  },
  {
    "sport": "NFL",
    "category": "History",
    "text": "\"The Catch\" sent the 49ers to the Super Bowl at the expense of which team?",
    "options": [
      "Los Angeles Rams",
      "Washington",
      "Dallas Cowboys",
      "Chicago Bears"
    ],
    "correctIndex": 2,
    "difficulty": 2
  },
  {
    "sport": "NFL",
    "category": "History",
    "text": "Which quarterback led \"The Drive\" against the Cleveland Browns in the 1986 AFC Championship?",
    "options": [
      "Joe Montana",
      "Jim Kelly",
      "Dan Marino",
      "John Elway"
    ],
    "correctIndex": 3,
    "difficulty": 2
  },
  {
    "sport": "NFL",
    "category": "History",
    "text": "Which Browns running back lost \"The Fumble\" in the 1987 AFC Championship?",
    "options": [
      "Leroy Kelly",
      "Earnest Byner",
      "Greg Pruitt",
      "Kevin Mack"
    ],
    "correctIndex": 1,
    "difficulty": 3
  },
  {
    "sport": "NFL",
    "category": "History",
    "text": "Which team won on the \"Music City Miracle\" kickoff return in January 2000?",
    "options": [
      "Buffalo Bills",
      "Tennessee Titans",
      "Jacksonville Jaguars",
      "Indianapolis Colts"
    ],
    "correctIndex": 1,
    "difficulty": 2
  },
  {
    "sport": "NFL",
    "category": "History",
    "text": "Who scored on the \"Minneapolis Miracle\" in January 2018?",
    "options": [
      "Stefon Diggs",
      "Adam Thielen",
      "Dalvin Cook",
      "Kyle Rudolph"
    ],
    "correctIndex": 0,
    "difficulty": 2
  },
  {
    "sport": "NFL",
    "category": "History",
    "text": "Who caught the \"Philly Special\" touchdown pass in Super Bowl LII?",
    "options": [
      "Zach Ertz",
      "Alshon Jeffery",
      "Trey Burton",
      "Nick Foles"
    ],
    "correctIndex": 3,
    "difficulty": 2
  },
  {
    "sport": "NFL",
    "category": "History",
    "text": "Which team beat the Patriots in Super Bowl LII?",
    "options": [
      "Atlanta Falcons",
      "Los Angeles Rams",
      "New York Giants",
      "Philadelphia Eagles"
    ],
    "correctIndex": 3,
    "difficulty": 1
  },
  {
    "sport": "NFL",
    "category": "History",
    "text": "The Patriots overcame a 28-3 deficit in Super Bowl LI against which team?",
    "options": [
      "Carolina Panthers",
      "Atlanta Falcons",
      "Los Angeles Rams",
      "Seattle Seahawks"
    ],
    "correctIndex": 1,
    "difficulty": 1
  },
  {
    "sport": "NFL",
    "category": "History",
    "text": "Super Bowl LI was the first Super Bowl to go to what?",
    "options": [
      "A replay review",
      "A tie",
      "A second-half delay",
      "Overtime"
    ],
    "correctIndex": 3,
    "difficulty": 2
  },
  {
    "sport": "NFL",
    "category": "History",
    "text": "Which team won Super Bowl LVIII in overtime?",
    "options": [
      "San Francisco 49ers",
      "Philadelphia Eagles",
      "Kansas City Chiefs",
      "Baltimore Ravens"
    ],
    "correctIndex": 2,
    "difficulty": 1
  },
  {
    "sport": "NFL",
    "category": "History",
    "text": "Where was Super Bowl LVIII played?",
    "options": [
      "Miami",
      "Phoenix",
      "Las Vegas",
      "New Orleans"
    ],
    "correctIndex": 2,
    "difficulty": 2
  },
  {
    "sport": "NFL",
    "category": "History",
    "text": "Which team won Super Bowl LIX?",
    "options": [
      "Buffalo Bills",
      "Washington Commanders",
      "Philadelphia Eagles",
      "Kansas City Chiefs"
    ],
    "correctIndex": 2,
    "difficulty": 1
  },
  {
    "sport": "NFL",
    "category": "History",
    "text": "What was the final score of Super Bowl LIX?",
    "options": [
      "Eagles 31, Chiefs 24",
      "Eagles 27, Chiefs 20",
      "Eagles 40, Chiefs 22",
      "Eagles 38, Chiefs 35"
    ],
    "correctIndex": 2,
    "difficulty": 2
  },
  {
    "sport": "NFL",
    "category": "History",
    "text": "Who was named MVP of Super Bowl LIX?",
    "options": [
      "Saquon Barkley",
      "Josh Sweat",
      "A.J. Brown",
      "Jalen Hurts"
    ],
    "correctIndex": 3,
    "difficulty": 2
  },
  {
    "sport": "NFL",
    "category": "History",
    "text": "In which city was Super Bowl LIX played?",
    "options": [
      "Las Vegas",
      "Miami",
      "New Orleans",
      "Atlanta"
    ],
    "correctIndex": 2,
    "difficulty": 2
  },
  {
    "sport": "NFL",
    "category": "History",
    "text": "Which team beat the Eagles in Super Bowl LVII?",
    "options": [
      "Kansas City Chiefs",
      "Buffalo Bills",
      "Cincinnati Bengals",
      "San Francisco 49ers"
    ],
    "correctIndex": 0,
    "difficulty": 1
  },
  {
    "sport": "NFL",
    "category": "History",
    "text": "Which team won Super Bowl LVI at its own home stadium, SoFi Stadium?",
    "options": [
      "Los Angeles Rams",
      "Tampa Bay Buccaneers",
      "Cincinnati Bengals",
      "Los Angeles Chargers"
    ],
    "correctIndex": 0,
    "difficulty": 1
  },
  {
    "sport": "NFL",
    "category": "History",
    "text": "In Super Bowl LV, which team became the first to win a Super Bowl in its home stadium?",
    "options": [
      "Kansas City Chiefs",
      "Los Angeles Rams",
      "Miami Dolphins",
      "Tampa Bay Buccaneers"
    ],
    "correctIndex": 3,
    "difficulty": 1
  },
  {
    "sport": "NFL",
    "category": "History",
    "text": "Which team did the Chiefs beat in Super Bowl LIV?",
    "options": [
      "Tampa Bay Buccaneers",
      "Los Angeles Rams",
      "Philadelphia Eagles",
      "San Francisco 49ers"
    ],
    "correctIndex": 3,
    "difficulty": 1
  },
  {
    "sport": "NFL",
    "category": "History",
    "text": "Tom Brady's first Super Bowl win came against which team?",
    "options": [
      "St. Louis Rams",
      "Seattle Seahawks",
      "Carolina Panthers",
      "Philadelphia Eagles"
    ],
    "correctIndex": 0,
    "difficulty": 2
  },
  {
    "sport": "NFL",
    "category": "History",
    "text": "Who made \"The Tackle\" at the 1-yard line to win Super Bowl XXXIV for the Rams?",
    "options": [
      "Todd Lyght",
      "Mike Jones",
      "London Fletcher",
      "Isaac Bruce"
    ],
    "correctIndex": 1,
    "difficulty": 3
  },
  {
    "sport": "NFL",
    "category": "History",
    "text": "In which year did the AFL and NFL fully merge?",
    "options": [